{"$schema":"https://json-schema.org/draft/2020-12/schema","additionalProperties":false,"properties":{"diagnostics":{"const":"diagnostics/diagnostics.json"},"family":{"const":"change-set"},"fixtures":{"const":"fixtures/cases.json"},"schemas":{"const":{"binding_request":"schemas/binding-request.schema.json","binding_result":"schemas/binding-result.schema.json","change_set":"schemas/change-set.schema.json","contract":"schemas/contract.schema.json","diagnostic":"schemas/diagnostic.schema.json"}},"side_effects":{"const":"forbidden"},"version":{"const":"1.0.0"}},"required":["diagnostics","family","fixtures","schemas","side_effects","version"],"type":"object"}
