{"diagnostics":"diagnostics/diagnostics.json","family":"change-set","fixtures":"fixtures/cases.json","schemas":{"binding_request":"schemas/binding-request.schema.json","binding_result":"schemas/binding-result.schema.json","change_set":"schemas/change-set.schema.json","contract":"schemas/contract.schema.json","diagnostic":"schemas/diagnostic.schema.json"},"side_effects":"forbidden","version":"1.0.0"}
